# visible | name                  | mask     | color | combinedDesc                    | description
  *       | POL_FLAG_1            | 00000001 | *     | DBL_SM_XXXX_MIR_XXXF1C_0402_POL | Flag indicating antenna HH (0) or VV (1) polarisation
  *       | POL_FLAG_2            | 00000002 | *     | DBL_SM_XXXX_MIR_XXXF1C_0402_POL | Flag indicating antenna HHV (0) or VVH (1) polarisation
  *       | SUN_FOV               | 00000004 | *     | *                               | Direct Sun correction for the Sun in the front of the FOV has been performed during image reconstruction of this pixel
  *       | SUN_GLINT_FOV         | 00000008 | *     | *                               | Reflected Sun correction has been performed during image reconstruction of this pixel. Sun correction is based on the Sea bistatic coefficients defined in the AUX_BSCAT ADF and computed for a fixed wind speed of 7 m/s and wind direction of 0 deg North
  *       | MOON_FOV              | 00000010 | *     | *                               | Moon correction has been performed during image reconstruction of this pixel
  *       | SINGLE_SNAPSHOT       | 00000020 | *     | *                               | Scene has been combined with opposite polarization during reconstruction of this pixel
  *       | RFI_MITIGATION        | 00000040 | *     | *                               | RFI mitigation has been performed during reconstruction of this pixel
  *       | SUN_POINT             | 00000080 | *     | *                               | Pixel is located in a zone (circle around Sun alias position with radius configurable through Sun_Point_Flag_Size field in AUX CNFL1P) where a Sun alias was reconstructed (if Sun removal is active, measurement may be degraded)
  *       | SUN_GLINT_AREA        | 00000100 | *     | *                               | Pixel is located in a zone where Sun reflection has been detected using the bi-static scattering coefficient threshold defined in the configuration file
  *       | MOON_POINT            | 00000200 | *     | *                               | Pixel is located in a zone where a Moon alias was reconstructed (after Moon removal, measurement may be degraded)
  *       | AF_FOV                | 00000400 | *     | *                               | Measurement is in the alias free field of view
  *       | RFI_TAILS             | 00000800 | *     | *                               | Measurement has been affected by tails from a point source RFI identified in the AUX_RFI list
  *       | BORDER_FOV            | 00001000 | *     | *                               | Measurement is near the border delimiting the Extended Alias Free zone or near to the unit circle replicas borders (aka belt & suspenders)
  *       | SUN_TAILS             | 00002000 | *     | *                               | Pixel is located in the hexagonal alias directions centred on a Sun alias
  *       | RFI_STRONG            | 00004000 | *     | *                               | Measurement is affected by strong self-estimated RFI in L1b
  *       | RFI_POINT             | 00008000 | *     | *                               | Measurement has been affected by point source RFI identified in the AUX_RFI list, or it has exceeded an RFI threshold